<?xml version="1.0" encoding="UTF-8"?>
<!DOCTYPE artworks SYSTEM "artworks.dtd">
<artworks><artwork id="A001" museum="met"><title>Starry Night Over the Rhône</title><artist>Vincent van Gogh</artist><year>1888</year><medium>Oil on canvas</medium><imageURL>https://images.metmuseum.org/CRDImages/ep/original/DT1567.jpg</imageURL><mood>dreamy</mood></artwork></artworks>
